{
  "$schema": "https://json-schema.org/draft/2020-12/schema",
  "$id": "https://harness.tcbs.vn/schemas/test-plan/v1",
  "title": "Test Plan (metadata)",
  "description": "Validate plans/<plan_id>/plan.json. Conditions KHÔNG nhúng vào đây — mỗi condition là một file tại conditions/<TCON-id>.json, validate bằng test-condition.schema.json. Thư mục conditions/ là nguồn sự thật về danh sách condition; harness kiểm referential integrity (plan_id khớp, tên file khớp id, mọi P0 requirement có condition).",
  "type": "object",
  "additionalProperties": false,
  "required": ["plan_id", "component", "spec_refs", "risk_tier", "spec_gaps"],
  "properties": {
    "plan_id": {
      "type": "string",
      "pattern": "^TP-[A-Z]+-\\d{4}$",
      "description": "Phải trùng tên thư mục plans/<plan_id>/ — harness kiểm"
    },
    "component": {
      "type": "string",
      "minLength": 1,
      "maxLength": 200,
      "description": "Package hoặc module được cover, ví dụ vn.tcbs.halo.matching"
    },
    "spec_refs": {
      "type": "array",
      "minItems": 1,
      "items": {
        "type": "string",
        "maxLength": 300,
        "description": "Đường dẫn/ID tài liệu spec làm nguồn"
      }
    },
    "risk_tier": {
      "enum": ["T0", "T1", "T2"],
      "description": "Do harness routing gán, Designer chép lại — không tự quyết"
    },
    "spec_gaps": {
      "type": "array",
      "description": "Behavior spec chưa cover hoặc mơ hồ. Rỗng nếu không có — nhưng field luôn phải hiện diện để Designer buộc phải cân nhắc.",
      "items": {
        "type": "object",
        "additionalProperties": false,
        "required": ["description", "location"],
        "properties": {
          "description": {
            "type": "string",
            "minLength": 10,
            "maxLength": 1000,
            "description": "Gap là gì; nếu mơ hồ, nêu cả hai cách hiểu"
          },
          "location": {
            "type": "string",
            "maxLength": 300,
            "description": "Vị trí trong spec (section/dòng) hoặc 'missing'"
          }
        }
      }
    }
  }
}
